{
  "spec_version": "oncemesh.evaluation/v0",
  "name": "python-docs-50",
  "allowed_hosts": ["docs.python.org"],
  "repetitions": 2,
  "request_delay_ms": 200,
  "urls": [
    {"url": "https://docs.python.org/3.14/library/functions.html", "accept": "text/html", "freshness_seconds": 86400, "estimated_fetch_cost": "0.000000"},
    {"url": "https://docs.python.org/3.14/library/constants.html", "accept": "text/html", "freshness_seconds": 86400, "estimated_fetch_cost": "0.000000"},
    {"url": "https://docs.python.org/3.14/library/stdtypes.html", "accept": "text/html", "freshness_seconds": 86400, "estimated_fetch_cost": "0.000000"},
    {"url": "https://docs.python.org/3.14/library/exceptions.html", "accept": "text/html", "freshness_seconds": 86400, "estimated_fetch_cost": "0.000000"},
    {"url": "https://docs.python.org/3.14/library/string.html", "accept": "text/html", "freshness_seconds": 86400, "estimated_fetch_cost": "0.000000"},
    {"url": "https://docs.python.org/3.14/library/re.html", "accept": "text/html", "freshness_seconds": 86400, "estimated_fetch_cost": "0.000000"},
    {"url": "https://docs.python.org/3.14/library/difflib.html", "accept": "text/html", "freshness_seconds": 86400, "estimated_fetch_cost": "0.000000"},
    {"url": "https://docs.python.org/3.14/library/textwrap.html", "accept": "text/html", "freshness_seconds": 86400, "estimated_fetch_cost": "0.000000"},
    {"url": "https://docs.python.org/3.14/library/unicodedata.html", "accept": "text/html", "freshness_seconds": 86400, "estimated_fetch_cost": "0.000000"},
    {"url": "https://docs.python.org/3.14/library/stringprep.html", "accept": "text/html", "freshness_seconds": 86400, "estimated_fetch_cost": "0.000000"},
    {"url": "https://docs.python.org/3.14/library/readline.html", "accept": "text/html", "freshness_seconds": 86400, "estimated_fetch_cost": "0.000000"},
    {"url": "https://docs.python.org/3.14/library/rlcompleter.html", "accept": "text/html", "freshness_seconds": 86400, "estimated_fetch_cost": "0.000000"},
    {"url": "https://docs.python.org/3.14/library/struct.html", "accept": "text/html", "freshness_seconds": 86400, "estimated_fetch_cost": "0.000000"},
    {"url": "https://docs.python.org/3.14/library/codecs.html", "accept": "text/html", "freshness_seconds": 86400, "estimated_fetch_cost": "0.000000"},
    {"url": "https://docs.python.org/3.14/library/datetime.html", "accept": "text/html", "freshness_seconds": 86400, "estimated_fetch_cost": "0.000000"},
    {"url": "https://docs.python.org/3.14/library/zoneinfo.html", "accept": "text/html", "freshness_seconds": 86400, "estimated_fetch_cost": "0.000000"},
    {"url": "https://docs.python.org/3.14/library/calendar.html", "accept": "text/html", "freshness_seconds": 86400, "estimated_fetch_cost": "0.000000"},
    {"url": "https://docs.python.org/3.14/library/collections.html", "accept": "text/html", "freshness_seconds": 86400, "estimated_fetch_cost": "0.000000"},
    {"url": "https://docs.python.org/3.14/library/collections.abc.html", "accept": "text/html", "freshness_seconds": 86400, "estimated_fetch_cost": "0.000000"},
    {"url": "https://docs.python.org/3.14/library/heapq.html", "accept": "text/html", "freshness_seconds": 86400, "estimated_fetch_cost": "0.000000"},
    {"url": "https://docs.python.org/3.14/library/bisect.html", "accept": "text/html", "freshness_seconds": 86400, "estimated_fetch_cost": "0.000000"},
    {"url": "https://docs.python.org/3.14/library/array.html", "accept": "text/html", "freshness_seconds": 86400, "estimated_fetch_cost": "0.000000"},
    {"url": "https://docs.python.org/3.14/library/weakref.html", "accept": "text/html", "freshness_seconds": 86400, "estimated_fetch_cost": "0.000000"},
    {"url": "https://docs.python.org/3.14/library/types.html", "accept": "text/html", "freshness_seconds": 86400, "estimated_fetch_cost": "0.000000"},
    {"url": "https://docs.python.org/3.14/library/copy.html", "accept": "text/html", "freshness_seconds": 86400, "estimated_fetch_cost": "0.000000"},
    {"url": "https://docs.python.org/3.14/library/pprint.html", "accept": "text/html", "freshness_seconds": 86400, "estimated_fetch_cost": "0.000000"},
    {"url": "https://docs.python.org/3.14/library/reprlib.html", "accept": "text/html", "freshness_seconds": 86400, "estimated_fetch_cost": "0.000000"},
    {"url": "https://docs.python.org/3.14/library/enum.html", "accept": "text/html", "freshness_seconds": 86400, "estimated_fetch_cost": "0.000000"},
    {"url": "https://docs.python.org/3.14/library/graphlib.html", "accept": "text/html", "freshness_seconds": 86400, "estimated_fetch_cost": "0.000000"},
    {"url": "https://docs.python.org/3.14/library/numbers.html", "accept": "text/html", "freshness_seconds": 86400, "estimated_fetch_cost": "0.000000"},
    {"url": "https://docs.python.org/3.14/library/math.html", "accept": "text/html", "freshness_seconds": 86400, "estimated_fetch_cost": "0.000000"},
    {"url": "https://docs.python.org/3.14/library/cmath.html", "accept": "text/html", "freshness_seconds": 86400, "estimated_fetch_cost": "0.000000"},
    {"url": "https://docs.python.org/3.14/library/decimal.html", "accept": "text/html", "freshness_seconds": 86400, "estimated_fetch_cost": "0.000000"},
    {"url": "https://docs.python.org/3.14/library/fractions.html", "accept": "text/html", "freshness_seconds": 86400, "estimated_fetch_cost": "0.000000"},
    {"url": "https://docs.python.org/3.14/library/random.html", "accept": "text/html", "freshness_seconds": 86400, "estimated_fetch_cost": "0.000000"},
    {"url": "https://docs.python.org/3.14/library/statistics.html", "accept": "text/html", "freshness_seconds": 86400, "estimated_fetch_cost": "0.000000"},
    {"url": "https://docs.python.org/3.14/library/itertools.html", "accept": "text/html", "freshness_seconds": 86400, "estimated_fetch_cost": "0.000000"},
    {"url": "https://docs.python.org/3.14/library/functools.html", "accept": "text/html", "freshness_seconds": 86400, "estimated_fetch_cost": "0.000000"},
    {"url": "https://docs.python.org/3.14/library/operator.html", "accept": "text/html", "freshness_seconds": 86400, "estimated_fetch_cost": "0.000000"},
    {"url": "https://docs.python.org/3.14/library/pathlib.html", "accept": "text/html", "freshness_seconds": 86400, "estimated_fetch_cost": "0.000000"},
    {"url": "https://docs.python.org/3.14/library/os.path.html", "accept": "text/html", "freshness_seconds": 86400, "estimated_fetch_cost": "0.000000"},
    {"url": "https://docs.python.org/3.14/library/tempfile.html", "accept": "text/html", "freshness_seconds": 86400, "estimated_fetch_cost": "0.000000"},
    {"url": "https://docs.python.org/3.14/library/glob.html", "accept": "text/html", "freshness_seconds": 86400, "estimated_fetch_cost": "0.000000"},
    {"url": "https://docs.python.org/3.14/library/fnmatch.html", "accept": "text/html", "freshness_seconds": 86400, "estimated_fetch_cost": "0.000000"},
    {"url": "https://docs.python.org/3.14/library/linecache.html", "accept": "text/html", "freshness_seconds": 86400, "estimated_fetch_cost": "0.000000"},
    {"url": "https://docs.python.org/3.14/library/shutil.html", "accept": "text/html", "freshness_seconds": 86400, "estimated_fetch_cost": "0.000000"},
    {"url": "https://docs.python.org/3.14/library/pickle.html", "accept": "text/html", "freshness_seconds": 86400, "estimated_fetch_cost": "0.000000"},
    {"url": "https://docs.python.org/3.14/library/copyreg.html", "accept": "text/html", "freshness_seconds": 86400, "estimated_fetch_cost": "0.000000"},
    {"url": "https://docs.python.org/3.14/library/shelve.html", "accept": "text/html", "freshness_seconds": 86400, "estimated_fetch_cost": "0.000000"},
    {"url": "https://docs.python.org/3.14/library/marshal.html", "accept": "text/html", "freshness_seconds": 86400, "estimated_fetch_cost": "0.000000"}
  ],
  "promotion": {
    "minimum_candidate_hits": 100,
    "maximum_mismatches": 0,
    "minimum_candidate_match_rate": "1.000000"
  }
}
